Company;Year;ISIN;restatement;SR;NFE;Date SRNFE;Date AR;ReportSize SRNFE;ReportSentence SRNFE;ReportWords SRNFE;GRI;Keywords;KeywordsClean;SentenceRestatement;ReportSize AR;ReportSentence AR;ReportWords AR
utd.internet ag_sr_;2018;DE0005089031;1;1;0;08.04.2019;fehlt;112;3771;30043;1;wert.*angepasst;wert angepasst;(27) angaben beziehen sich auf stammmitarbeiter in den ersten beiden führungsebenen vorjahreswerte angepasst nach entkonsolidierung affilinet(28) angaben beziehen sich auf unsere aktiven mitarbeiter(29) angaben für 2016 und 2017 beziehen sich auf unsere stammmitarbeiter in deutschland ohne beteiligungen ab 2018 auf unsere stammmitarbeiter;fehlt;fehlt;fehlt;C:\Users\test\Documents\GitHub\hhu_whk_project_restatements\data\raw_nachgeliefert_ganz\2. Fehlende SRs 2008-2020\UTD.Internet AG_SR_2018.pdf
utd.internet ag_sr_;2018;DE0005089031;1;1;0;08.04.2019;fehlt;112;3771;30043;1;wert.*angepasst;wert angepasst;in deutschland ohne profitbricks / 1&1 ionos cloud und drillisch gesellschaften(30) wert für 2016 wurde angepasst;fehlt;fehlt;fehlt;C:\Users\test\Documents\GitHub\hhu_whk_project_restatements\data\raw_nachgeliefert_ganz\2. Fehlende SRs 2008-2020\UTD.Internet AG_SR_2018.pdf
utd.internet ag_sr_;2018;DE0005089031;1;1;0;08.04.2019;fehlt;112;3771;30043;1;angepasst.*daten;angepasst daten;(31) darstellung sowie werte für 2016 und 2017 angepasst im berichtsjahr ist an vielen stellen die datenerhebung erweitert und optimiert worden und es wurden weitere gesellschaften in die datenerhebung aufgenommen, was sich in einem anstieg der werte niederschlägt;fehlt;fehlt;fehlt;C:\Users\test\Documents\GitHub\hhu_whk_project_restatements\data\raw_nachgeliefert_ganz\2. Fehlende SRs 2008-2020\UTD.Internet AG_SR_2018.pdf
utd.internet ag_sr_;2018;DE0005089031;1;1;0;08.04.2019;fehlt;112;3771;30043;1;wert.*angepasst;wert angepasst;(32) darstellung sowie werte für 2016 und 2017 angepasst angaben beziehen sich auf zehn eigene sowie angemietete rechenzentren für das jahr 2016 auf die rechenzentren von 1&1 ionos, arsys und fasthosts ab 2017 zudem anteilig für strato, ab 2018 zudem für strato gesamt sowie für die hinzugekommenen rechenzentren von profitbricks / 1&1 ionos cloud, home;fehlt;fehlt;fehlt;C:\Users\test\Documents\GitHub\hhu_whk_project_restatements\data\raw_nachgeliefert_ganz\2. Fehlende SRs 2008-2020\UTD.Internet AG_SR_2018.pdf
utd.internet ag_sr_;2018;DE0005089031;1;1;0;08.04.2019;fehlt;112;3771;30043;1;wert.*angepasst;wert angepasst;(33) darstellung sowie werte für 2017 angepasst angaben beruhen für vereinzelte standorte, für die noch keine ablesungen vorliegen, auf  schätzungen die aufgeführten stromverbräuche der jeweiligen jahre unterliegen aufgrund von schwankungen in den ablese- und rechnungs-terminen einer versetzten zuordnung zu zeitperioden, wodurch sich vorjahreszahlen im nachgang zum bericht verändern können;fehlt;fehlt;fehlt;C:\Users\test\Documents\GitHub\hhu_whk_project_restatements\data\raw_nachgeliefert_ganz\2. Fehlende SRs 2008-2020\UTD.Internet AG_SR_2018.pdf
utd.internet ag_sr_;2018;DE0005089031;1;1;0;08.04.2019;fehlt;112;3771;30043;1;bericht.*angepasst;bericht angepasst;(40) darstellung und geltungsbereiche wurden im berichtsjahr angepasst, siehe kapitel „umwelt“(41) angaben beziehen sich 2016 und 2017 auf die united internet gruppe in deutschland ohne 1&1 versatel, strato und drillisch ab 2018 ergänzt um;fehlt;fehlt;fehlt;C:\Users\test\Documents\GitHub\hhu_whk_project_restatements\data\raw_nachgeliefert_ganz\2. Fehlende SRs 2008-2020\UTD.Internet AG_SR_2018.pdf
utd.internet ag_sr_;2018;DE0005089031;1;1;0;08.04.2019;fehlt;112;3771;30043;1;daten.*angepasst;daten angepasst;1&1 versatel und drillisch sowie neubestellungen von strato die datenerhebung ist im berichtsjahr deutlich erweitert und optimiert worden(42) werte für 2016 und 2017 angepasst angaben beziehen sich 2016 auf die united internet gruppe in deutschland ab 2017 ergänzt um strato und;fehlt;fehlt;fehlt;C:\Users\test\Documents\GitHub\hhu_whk_project_restatements\data\raw_nachgeliefert_ganz\2. Fehlende SRs 2008-2020\UTD.Internet AG_SR_2018.pdf
utd.internet ag_sr_;2018;DE0005089031;1;1;0;08.04.2019;fehlt;112;3771;30043;1;angepasst.*daten;angepasst daten;(43) werte für 2016 und 2017 angepasst angaben beziehen sich 2016 und 2017 auf die united internet gruppe in deutschland ohne 1&1 versatel, strato, drillisch ab 2018 ergänzt um 1&1 versatel und strato sowie relevante im ausland ansässige unternehmen die datenerhebung ist im berichtsjahr deutlich erweitert und optimiert worden errechnet anhand der angaben des bundesverbands der deutschen luftverkehrswirtschaft (bdl) zum durchschnittlichen kerosinverbrauch pro passagier und 100 km 2016: 3,64 l 2017: 3,58 l, mit dem 2017er wert wurde auch für das berichtsjahr gerechnet;fehlt;fehlt;fehlt;C:\Users\test\Documents\GitHub\hhu_whk_project_restatements\data\raw_nachgeliefert_ganz\2. Fehlende SRs 2008-2020\UTD.Internet AG_SR_2018.pdf
utd.internet ag_sr_;2018;DE0005089031;1;1;0;08.04.2019;fehlt;112;3771;30043;1;zahl.*angepasst;zahl angepasst;(44) angaben beziehen sich auf die mitarbeiter der unter (41) genannten gesellschaften(45) angaben beziehen sich auf die mitarbeiter der united internet gruppe in deutschland zahlen für 2016 und 2017 wurden angepasst(46) angaben beziehen sich auf die mitarbeiter der unter (43) genannten gesellschaften(47) darstellung angepasst(48) angaben beziehen sich auf die unter (41) genannten gesellschaften angaben beruhen z;fehlt;fehlt;fehlt;C:\Users\test\Documents\GitHub\hhu_whk_project_restatements\data\raw_nachgeliefert_ganz\2. Fehlende SRs 2008-2020\UTD.Internet AG_SR_2018.pdf
utd.internet ag_sr_;2018;DE0005089031;1;1;0;08.04.2019;fehlt;112;3771;30043;1;vorjahr.*wert;vorjahr wert;an geeigneten stellen werden in anwendung der gri-standards zum vergleich auch vorjahreswerte für die geschäftsjahre 2016 und 2017 dargestellt oder ausblicke gegeben;fehlt;fehlt;fehlt;C:\Users\test\Documents\GitHub\hhu_whk_project_restatements\data\raw_nachgeliefert_ganz\2. Fehlende SRs 2008-2020\UTD.Internet AG_SR_2018.pdf
verallia deutschland;2020;DE0006851603;1;1;0;28.07.2021;fehlt;41;2227;23044;0;wert.*korrektur;wert korrektur;das 2019 eingeleitete mapping der csr- risiken von lieferanten ermöglichte 2020 den start von lieferantenbewertungen und -audits sowie 2021 die  identifizierung von korrekturmaßnahmen;fehlt;fehlt;fehlt;C:\Users\test\Documents\GitHub\hhu_whk_project_restatements\data\raw_nachgeliefert_ganz\2. Fehlende SRs 2008-2020\Verallia Deutschland2020_SR.pdf
verallia deutschland;2020;DE0006851603;1;1;0;28.07.2021;fehlt;41;2227;23044;0;wert.*korrektur;wert korrektur;dieser umfasst risk mapping, bewertung der lieferanten (ecovadis/acesia), externe vor-ort-csr-audits basierend auf den internationalen smeta-standards, korrekturmaß- nahmenpläne bei nachgewiesener nichteinhaltung und einen auslistungsprozess bei schwerwiegender nichteinhal-tung oder nichterfüllung der korrekturmaßnahmenpläne;fehlt;fehlt;fehlt;C:\Users\test\Documents\GitHub\hhu_whk_project_restatements\data\raw_nachgeliefert_ganz\2. Fehlende SRs 2008-2020\Verallia Deutschland2020_SR.pdf
verallia deutschland;2020;DE0006851603;1;1;0;28.07.2021;fehlt;41;2227;23044;0;zahl.*angepasst;zahl angepasst;hinweis: in bezug auf den indikator "anzahl der verkauften flaschen und gläser aus dem ecova- und ego-sortiment: in dieser tabelle wurden die zahlen für 2018 und 2019 im vergleich zu den im statement of extra-financial performance 2019 angegebenen zahlen angepasst, da bestimmte ecova-artikel nicht korrekt benannt waren (ecv oder eco statt ecova) und daher nicht gezählt wurden;fehlt;fehlt;fehlt;C:\Users\test\Documents\GitHub\hhu_whk_project_restatements\data\raw_nachgeliefert_ganz\2. Fehlende SRs 2008-2020\Verallia Deutschland2020_SR.pdf
verallia deutschland;2020;DE0006851603;1;1;0;28.07.2021;fehlt;41;2227;23044;0;scope.*vorjahr;scope vorjahr;—  (1)  1 % der gesamten scope-1- und scope-2-co2-emissionen, berechnet im vergleich zu den emissionen des vorjahres;fehlt;fehlt;fehlt;C:\Users\test\Documents\GitHub\hhu_whk_project_restatements\data\raw_nachgeliefert_ganz\2. Fehlende SRs 2008-2020\Verallia Deutschland2020_SR.pdf
verallia deutschland;2020;DE0006851603;1;1;0;28.07.2021;fehlt;41;2227;23044;0;aktualisier.*standard;aktualisier standard;nach der aktualisierung der gesundheits- und sicherheitsstandards im jahr 2018 wurde im jahr 2020 eine phase des coachings von ehs-managern vor ort eingeführt, die sich auf die analyse der unfallursachen konzentriert;fehlt;fehlt;fehlt;C:\Users\test\Documents\GitHub\hhu_whk_project_restatements\data\raw_nachgeliefert_ganz\2. Fehlende SRs 2008-2020\Verallia Deutschland2020_SR.pdf
verallia deutschland;2020;DE0006851603;1;1;0;28.07.2021;fehlt;41;2227;23044;0;vorjahr.*wert;vorjahr wert;der gleichstellungsindex ist im vergleich zum vorjahr um 10 punkte gestiegen, mit deutlichen fortschritten in lateinamerika,  was deutlich zurücklag, und in südeuropa, wo wie in frankreich werte deutlich über dem zielwert erreicht wurden;fehlt;fehlt;fehlt;C:\Users\test\Documents\GitHub\hhu_whk_project_restatements\data\raw_nachgeliefert_ganz\2. Fehlende SRs 2008-2020\Verallia Deutschland2020_SR.pdf
verallia deutschland;2020;DE0006851603;1;1;0;28.07.2021;fehlt;41;2227;23044;0;wert.*korrektur;wert korrektur;das mitarbeiterengagement wird alle zwei jahre durch eine zufriedenheitsumfrage bewertet (die letzte wurde im märz 2019 durchgeführt), die zu plänen für korrekturmaßnahmen führt;fehlt;fehlt;fehlt;C:\Users\test\Documents\GitHub\hhu_whk_project_restatements\data\raw_nachgeliefert_ganz\2. Fehlende SRs 2008-2020\Verallia Deutschland2020_SR.pdf
volkswagen ag_sr_;2010;DE0007664039;1;1;0;03.05.2011;fehlt;79;3646;25403;1;bericht.*aktualisier;bericht aktualisier;die fakten dieses berichts werden laufend im internet aktualisiert;fehlt;fehlt;fehlt;C:\Users\test\Documents\GitHub\hhu_whk_project_restatements\data\raw_nachgeliefert_ganz\2. Fehlende SRs 2008-2020\Volkswagen AG_SR_2010.pdf
volkswagen ag_sr_;2010;DE0007664039;1;1;0;03.05.2011;fehlt;79;3646;25403;1;wert.*angepasst;wert angepasst;der vorjahreswert wurde angepasst;fehlt;fehlt;fehlt;C:\Users\test\Documents\GitHub\hhu_whk_project_restatements\data\raw_nachgeliefert_ganz\2. Fehlende SRs 2008-2020\Volkswagen AG_SR_2010.pdf
volkswagen ag_sr_;2010;DE0007664039;1;1;0;03.05.2011;fehlt;79;3646;25403;1;daten.*anpass;daten anpass;für die umweltdaten der dargestellten jahre  wurde die erfas-sung an den standorten weiter verbessert, dadurch ergaben sich einige geringfügige datenanpassungen der vorjahreswerte;fehlt;fehlt;fehlt;C:\Users\test\Documents\GitHub\hhu_whk_project_restatements\data\raw_nachgeliefert_ganz\2. Fehlende SRs 2008-2020\Volkswagen AG_SR_2010.pdf
volkswagen ag_sr_;2013;DE0007664039;1;1;0;23.04.2014;fehlt;151;7586;67241;1;vorjahr.*angepasst;vorjahr angepasst;3 das vorjahr wurde aufgrund der geänderten ias 19 angepasst;fehlt;fehlt;fehlt;C:\Users\test\Documents\GitHub\hhu_whk_project_restatements\data\raw_nachgeliefert_ganz\2. Fehlende SRs 2008-2020\Volkswagen AG_SR_2013.pdf
volkswagen ag_sr_;2013;DE0007664039;1;1;0;23.04.2014;fehlt;151;7586;67241;1;standard.*korrigier;standard korrigier;lieferantenmonitoringwenn wir informationen erhalten oder auf basis unseres  frühwarnsystems zu vermuten ist, dass 1st-tier-lieferanten oder sublieferanten unsere nachhaltigkeitsanforderungen nicht er-füllen oder die antworten auf unseren fragebogen nachhaltigkeit nicht zufriedenstellend sind, bitten wir diese um eine schriftliche stellungnahme auf grundlage eines standardisierten berichts (sogenannter 6-d-report): anhand von sechs zu beantwortenden punkten können sie den sachverhalt und korrigierende maßnah-men darstellen;fehlt;fehlt;fehlt;C:\Users\test\Documents\GitHub\hhu_whk_project_restatements\data\raw_nachgeliefert_ganz\2. Fehlende SRs 2008-2020\Volkswagen AG_SR_2013.pdf
volkswagen ag_sr_;2013;DE0007664039;1;1;0;23.04.2014;fehlt;151;7586;67241;1;vorjahr.*zahl;vorjahr zahl;die im ver-gleich  zum vorjahr gestiegene zahl ist unter anderem darauf zurückzu führen, dass die  qualitätsprozessauditoren und das kaufteile management (außendienst) kontinuierlich sensibili-siert werden, auf verstöße der zulieferer zu achten;fehlt;fehlt;fehlt;C:\Users\test\Documents\GitHub\hhu_whk_project_restatements\data\raw_nachgeliefert_ganz\2. Fehlende SRs 2008-2020\Volkswagen AG_SR_2013.pdf
volkswagen ag_sr_;2013;DE0007664039;1;1;0;23.04.2014;fehlt;151;7586;67241;1;vorjahr.*bericht;vorjahr bericht;schulungen für lieferanten wie schon in den vorjahren fanden im berichtszeitraum in ver-schiedenen regionen workshops oder nachhaltigkeitstrainings mit und für lokale lieferanten statt;fehlt;fehlt;fehlt;C:\Users\test\Documents\GitHub\hhu_whk_project_restatements\data\raw_nachgeliefert_ganz\2. Fehlende SRs 2008-2020\Volkswagen AG_SR_2013.pdf
volkswagen ag_sr_;2013;DE0007664039;1;1;0;23.04.2014;fehlt;151;7586;67241;1;standard.*angepasst;standard angepasst;bestehende vorsorgeuntersuchungs-programme wurden an den konzernweiten standard des check-ups angepasst, so zum beispiel im jahr 2013 bei škoda in tschechien;fehlt;fehlt;fehlt;C:\Users\test\Documents\GitHub\hhu_whk_project_restatements\data\raw_nachgeliefert_ganz\2. Fehlende SRs 2008-2020\Volkswagen AG_SR_2013.pdf
volkswagen ag_sr_;2013;DE0007664039;1;1;0;23.04.2014;fehlt;151;7586;67241;1;zahl.*vorjahr;zahl vorjahr;aufgrund der hohen qualität und zahl antriebstechnischer neuerungen konnte der volkswagen konzern seine innovations­führerschaft im vergleich zum vorjahr weiter ausbauen;fehlt;fehlt;fehlt;C:\Users\test\Documents\GitHub\hhu_whk_project_restatements\data\raw_nachgeliefert_ganz\2. Fehlende SRs 2008-2020\Volkswagen AG_SR_2013.pdf
volkswagen ag_sr_;2013;DE0007664039;1;1;0;23.04.2014;fehlt;151;7586;67241;1;method.*vorjahr;method vorjahr;änderungen der methoden und messverfahrendie dargestellten kennzahlen führen jene der vorjahre fort;fehlt;fehlt;fehlt;C:\Users\test\Documents\GitHub\hhu_whk_project_restatements\data\raw_nachgeliefert_ganz\2. Fehlende SRs 2008-2020\Volkswagen AG_SR_2013.pdf
volkswagen ag_sr_;2013;DE0007664039;1;1;0;23.04.2014;fehlt;151;7586;67241;1;^\d+\W*aktualisier;aktualisier;2002, aktualisiert 2012;fehlt;fehlt;fehlt;C:\Users\test\Documents\GitHub\hhu_whk_project_restatements\data\raw_nachgeliefert_ganz\2. Fehlende SRs 2008-2020\Volkswagen AG_SR_2013.pdf
volkswagen ag_sr_;2013;DE0007664039;1;1;0;23.04.2014;fehlt;151;7586;67241;1;vorjahr.*angepasst;vorjahr angepasst;2 das vorjahr wurde aufgrund des geänderten ias 19 angepasst;fehlt;fehlt;fehlt;C:\Users\test\Documents\GitHub\hhu_whk_project_restatements\data\raw_nachgeliefert_ganz\2. Fehlende SRs 2008-2020\Volkswagen AG_SR_2013.pdf
volkswagen ag_sr_;2013;DE0007664039;1;1;0;23.04.2014;fehlt;151;7586;67241;1;vorjahr.*angepasst;vorjahr angepasst;2 das vorjahr wurde aufgrund der geänderten ias 19 angepasst;fehlt;fehlt;fehlt;C:\Users\test\Documents\GitHub\hhu_whk_project_restatements\data\raw_nachgeliefert_ganz\2. Fehlende SRs 2008-2020\Volkswagen AG_SR_2013.pdf
volkswagen ag_sr_;2013;DE0007664039;1;1;0;23.04.2014;fehlt;151;7586;67241;1;vorjahr.*angepasst;vorjahr angepasst;3 das vorjahr wurde aufgrund der geänderten ias 19 angepasst;fehlt;fehlt;fehlt;C:\Users\test\Documents\GitHub\hhu_whk_project_restatements\data\raw_nachgeliefert_ganz\2. Fehlende SRs 2008-2020\Volkswagen AG_SR_2013.pdf
volkswagen ag_sr_;2013;DE0007664039;1;1;0;23.04.2014;fehlt;151;7586;67241;1;wert.*angepasst;wert angepasst;die vorjahreswerte wurden angepasst;fehlt;fehlt;fehlt;C:\Users\test\Documents\GitHub\hhu_whk_project_restatements\data\raw_nachgeliefert_ganz\2. Fehlende SRs 2008-2020\Volkswagen AG_SR_2013.pdf
volkswagen ag_sr_;2013;DE0007664039;1;1;0;23.04.2014;fehlt;151;7586;67241;1;vorjahr.*angepasst;vorjahr angepasst;2 das vorjahr wurde aufgrund der geänderten ias 19 angepasst;fehlt;fehlt;fehlt;C:\Users\test\Documents\GitHub\hhu_whk_project_restatements\data\raw_nachgeliefert_ganz\2. Fehlende SRs 2008-2020\Volkswagen AG_SR_2013.pdf
volkswagen ag_sr_;2013;DE0007664039;1;1;0;23.04.2014;fehlt;151;7586;67241;1;standard.*angepasst;standard angepasst;bestehende vorsorgeuntersuchungsprogramme wurden an den konzernweiten standard des checkups angepasst,  so zum beispiel bei škoda, wo bereits über 15;fehlt;fehlt;fehlt;C:\Users\test\Documents\GitHub\hhu_whk_project_restatements\data\raw_nachgeliefert_ganz\2. Fehlende SRs 2008-2020\Volkswagen AG_SR_2013.pdf
volkswagen ag_sr_;2013;DE0007664039;1;1;0;23.04.2014;fehlt;151;7586;67241;1;bericht.*angepasst;bericht angepasst;aktuelle nachrichten zu nachhaltigkeit im volkswagen konzern werden laufend im konzernportal ein-gestellt seine inhalte wurden gemäß dem bericht 2013 angepasst:  www;fehlt;fehlt;fehlt;C:\Users\test\Documents\GitHub\hhu_whk_project_restatements\data\raw_nachgeliefert_ganz\2. Fehlende SRs 2008-2020\Volkswagen AG_SR_2013.pdf
volkswagen ag_sr_;2016;DE0007664039;1;1;0;30.05.2017;fehlt;192;7231;69384;1;wert.*anpass;wert anpass;dabei spielt die stetige auswertung von rückmeldungen der integritätsbotschaf-ter sowie der mitarbeiter und manager zu fragen der anpassung und weiterentwicklung von konzepten ebenso eine rolle wie die berichterstattung in internen medien und publikationen wie dem nachhaltigkeitsbericht;fehlt;fehlt;fehlt;C:\Users\test\Documents\GitHub\hhu_whk_project_restatements\data\raw_nachgeliefert_ganz\2. Fehlende SRs 2008-2020\Volkswagen AG_SR_2016.pdf
volkswagen ag_sr_;2016;DE0007664039;1;1;0;30.05.2017;fehlt;192;7231;69384;1;wert.*vorjahr;wert vorjahr;fahrzeuge und übertraf damit den bisherigen rekordwert aus dem vorjahr um 5,4 %;fehlt;fehlt;fehlt;C:\Users\test\Documents\GitHub\hhu_whk_project_restatements\data\raw_nachgeliefert_ganz\2. Fehlende SRs 2008-2020\Volkswagen AG_SR_2016.pdf
volkswagen ag_sr_;2016;DE0007664039;1;1;0;30.05.2017;fehlt;192;7231;69384;1;standard.*angepasst;standard angepasst;vorhandene vorsorgeunter-suchungsprogramme wurden an konzernweite standards angepasst;fehlt;fehlt;fehlt;C:\Users\test\Documents\GitHub\hhu_whk_project_restatements\data\raw_nachgeliefert_ganz\2. Fehlende SRs 2008-2020\Volkswagen AG_SR_2016.pdf
volkswagen ag_sr_;2016;DE0007664039;1;1;0;30.05.2017;fehlt;192;7231;69384;1;vorjahr.*zahl;vorjahr zahl;der anstieg gegenüber dem vorjahr resultiert insbesondere aus einer höheren zahl von anmeldungen in den bereichen fahrerassistenzsysteme, konventionelle und alternative antriebe sowie leichtbau und unterstreicht erneut die hohe innovationskraft des unternehmens;fehlt;fehlt;fehlt;C:\Users\test\Documents\GitHub\hhu_whk_project_restatements\data\raw_nachgeliefert_ganz\2. Fehlende SRs 2008-2020\Volkswagen AG_SR_2016.pdf
volkswagen ag_sr_;2016;DE0007664039;1;1;0;30.05.2017;fehlt;192;7231;69384;1;zahl.*vorjahr;zahl vorjahr;die dargestellten kennzahlen führen jene der vorjahre fort;fehlt;fehlt;fehlt;C:\Users\test\Documents\GitHub\hhu_whk_project_restatements\data\raw_nachgeliefert_ganz\2. Fehlende SRs 2008-2020\Volkswagen AG_SR_2016.pdf
volkswagen ag_sr_;2016;DE0007664039;1;1;0;30.05.2017;fehlt;192;7231;69384;1;zahl.*vorjahr;zahl vorjahr;kennzahlen umweltwie in den vorjahren weisen wir auch für das berichtsjahr 2016 wichtige umweltkennzahlen der produktion aus;fehlt;fehlt;fehlt;C:\Users\test\Documents\GitHub\hhu_whk_project_restatements\data\raw_nachgeliefert_ganz\2. Fehlende SRs 2008-2020\Volkswagen AG_SR_2016.pdf
volkswagen ag_sr_;2016;DE0007664039;1;1;0;30.05.2017;fehlt;192;7231;69384;1;bericht.*vorjahr;bericht vorjahr;das aktuelle berichtsjahr und das entsprechende vorjahr vervollständigen den berichtszeitraum;fehlt;fehlt;fehlt;C:\Users\test\Documents\GitHub\hhu_whk_project_restatements\data\raw_nachgeliefert_ganz\2. Fehlende SRs 2008-2020\Volkswagen AG_SR_2016.pdf
volkswagen ag_sr_;2016;DE0007664039;1;1;0;30.05.2017;fehlt;192;7231;69384;1;anpass.*wert;anpass wert;die anpassung gegenüber den vorjahrswerten erfolgt aufgrund einer bilanzraum-erweiterung;fehlt;fehlt;fehlt;C:\Users\test\Documents\GitHub\hhu_whk_project_restatements\data\raw_nachgeliefert_ganz\2. Fehlende SRs 2008-2020\Volkswagen AG_SR_2016.pdf
volkswagen ag_sr_;2018;DE0007664039;1;1;0;01.04.2019;fehlt;109;5094;39834;1;wert.*angepasst;wert angepasst;vorjahreswerte angepasst;fehlt;fehlt;fehlt;C:\Users\test\Documents\GitHub\hhu_whk_project_restatements\data\raw_nachgeliefert_ganz\2. Fehlende SRs 2008-2020\Volkswagen AG_SR_2018.pdf
volkswagen ag_sr_;2018;DE0007664039;1;1;0;01.04.2019;fehlt;109;5094;39834;1;zahl.*vorjahr;zahl vorjahr;die dargestellten kennzahlen führen jene der vorjahre fort;fehlt;fehlt;fehlt;C:\Users\test\Documents\GitHub\hhu_whk_project_restatements\data\raw_nachgeliefert_ganz\2. Fehlende SRs 2008-2020\Volkswagen AG_SR_2018.pdf
volkswagen ag_sr_;2018;DE0007664039;1;1;0;01.04.2019;fehlt;109;5094;39834;1;bericht.*vorjahr;bericht vorjahr;entsprechend unserer umweltstrategie beziehen sich die abgebil-deten zeitreihen auf das basisjahr 2010 und zeigen den vergleich zum aktuellen berichtsjahr sowie zum vorjahr;fehlt;fehlt;fehlt;C:\Users\test\Documents\GitHub\hhu_whk_project_restatements\data\raw_nachgeliefert_ganz\2. Fehlende SRs 2008-2020\Volkswagen AG_SR_2018.pdf
volkswagen ag_sr_;2018;DE0007664039;1;1;0;01.04.2019;fehlt;109;5094;39834;1;wert.*angepasst;wert angepasst;5  well-to-wheel, wert berichtsjahr 2017 rückwirkend angepasst mit laufleistung 200;fehlt;fehlt;fehlt;C:\Users\test\Documents\GitHub\hhu_whk_project_restatements\data\raw_nachgeliefert_ganz\2. Fehlende SRs 2008-2020\Volkswagen AG_SR_2018.pdf
wacker chemie_sr_;2014;DE000WACK012;1;1;0;05.08.2015;fehlt;215;6974;43457;1;^\d+\W*korrektur;korrektur;2 korrektur der nox-emissionen für den standort holla für das jahr 2013, da die exakte bilanzierung erstnachträglich verfügbar war;fehlt;fehlt;fehlt;C:\Users\test\Documents\GitHub\hhu_whk_project_restatements\data\raw_nachgeliefert_ganz\2. Fehlende SRs 2008-2020\Wacker Chemie_SR_2014.pdf
wacker chemie_sr_;2014;DE000WACK012;1;1;0;05.08.2015;fehlt;215;6974;43457;1;method.*angepasst;method angepasst;3 die methodik zur ermittlung der gesamtemission an flüchtigen organischen verbindungen ohne methan(nmvoc) aus unserer produktion wurde im jahr 2014 angepasst;fehlt;fehlt;fehlt;C:\Users\test\Documents\GitHub\hhu_whk_project_restatements\data\raw_nachgeliefert_ganz\2. Fehlende SRs 2008-2020\Wacker Chemie_SR_2014.pdf
wacker chemie_sr_;2014;DE000WACK012;1;1;0;05.08.2015;fehlt;215;6974;43457;1;daten.*korrigier;daten korrigier;wir haben die datenermittlung vereinheitlicht,weitere stoffe berücksichtigt und die zahlen der vorjahre anhand der neuen methodik korrigiert;fehlt;fehlt;fehlt;C:\Users\test\Documents\GitHub\hhu_whk_project_restatements\data\raw_nachgeliefert_ganz\2. Fehlende SRs 2008-2020\Wacker Chemie_SR_2014.pdf
wacker chemie_sr_;2014;DE000WACK012;1;1;0;05.08.2015;fehlt;215;6974;43457;1;angepasst.*method;angepasst method;auf basis der angepassten methode zur nmvoc-bilanzierung reduktionspotenziale für;fehlt;fehlt;fehlt;C:\Users\test\Documents\GitHub\hhu_whk_project_restatements\data\raw_nachgeliefert_ganz\2. Fehlende SRs 2008-2020\Wacker Chemie_SR_2014.pdf
wacker chemie_sr_;2014;DE000WACK012;1;1;0;05.08.2015;fehlt;215;6974;43457;1;method.*aktualisier;method aktualisier;teilungen mit einer vertieften methode überprüfen und aktualisieren;fehlt;fehlt;fehlt;C:\Users\test\Documents\GitHub\hhu_whk_project_restatements\data\raw_nachgeliefert_ganz\2. Fehlende SRs 2008-2020\Wacker Chemie_SR_2014.pdf
wacker chemie_sr_;2014;DE000WACK012;1;1;0;05.08.2015;fehlt;215;6974;43457;1;scope.*angepasst;scope angepasst;im jahr 2014 haben wirzusätzliche scope-3-kategorien ergänzt und die methodik der erfassung dem leitfadendes ghg-protokolls für die chemische industrie angepasst;fehlt;fehlt;fehlt;C:\Users\test\Documents\GitHub\hhu_whk_project_restatements\data\raw_nachgeliefert_ganz\2. Fehlende SRs 2008-2020\Wacker Chemie_SR_2014.pdf
wacker chemie_sr_;2014;DE000WACK012;1;1;0;05.08.2015;fehlt;215;6974;43457;1;vorjahr.*scope;vorjahr scope;seit dem vorjahr mit dem ergebnis 86 bhaben wir unser co2-reduktionsziel definiert und unsere berichterstattung der chancenund risiken sowie der indirekten emissionen aus der wertschöpfungskette (scope 3)erweitert;fehlt;fehlt;fehlt;C:\Users\test\Documents\GitHub\hhu_whk_project_restatements\data\raw_nachgeliefert_ganz\2. Fehlende SRs 2008-2020\Wacker Chemie_SR_2014.pdf
wacker chemie_sr_;2014;DE000WACK012;1;1;0;05.08.2015;fehlt;215;6974;43457;1;method.*angepasst;method angepasst;1 die methodik zur ermittlung der gesamtemission an flüchtigen organischen verbindungen ohne methan(nmvoc) aus unserer produktion wurde im jahr 2014 angepasst;fehlt;fehlt;fehlt;C:\Users\test\Documents\GitHub\hhu_whk_project_restatements\data\raw_nachgeliefert_ganz\2. Fehlende SRs 2008-2020\Wacker Chemie_SR_2014.pdf
wacker chemie_sr_;2014;DE000WACK012;1;1;0;05.08.2015;fehlt;215;6974;43457;1;wert.*korrigier;wert korrigier;die umweltleistungsbewertung der vorjahre wurde korrigiert;fehlt;fehlt;fehlt;C:\Users\test\Documents\GitHub\hhu_whk_project_restatements\data\raw_nachgeliefert_ganz\2. Fehlende SRs 2008-2020\Wacker Chemie_SR_2014.pdf
wacker chemie_sr_;2014;DE000WACK012;1;1;0;05.08.2015;fehlt;215;6974;43457;1;method.*angepasst;method angepasst;bei der betrachtung der gesamtemission flüchtiger organischer verbindungen ohnemethan (nmvoc) haben wir im jahr 2014 die methodik zur bilanzierung angepasst;fehlt;fehlt;fehlt;C:\Users\test\Documents\GitHub\hhu_whk_project_restatements\data\raw_nachgeliefert_ganz\2. Fehlende SRs 2008-2020\Wacker Chemie_SR_2014.pdf
wacker chemie_sr_;2014;DE000WACK012;1;1;0;05.08.2015;fehlt;215;6974;43457;1;daten.*korrigier;daten korrigier;die emissionsdaten aus unseren sprühtrocknernin burghausen, calvert city und nanjing haben wir entsprechend der neuen methoderückwirkend korrigiert;fehlt;fehlt;fehlt;C:\Users\test\Documents\GitHub\hhu_whk_project_restatements\data\raw_nachgeliefert_ganz\2. Fehlende SRs 2008-2020\Wacker Chemie_SR_2014.pdf
